{
  "$schema": "https://json-schema.org/draft/2020-12/schema",
  "$id": "https://legal-tender.local/contracts/sources/fec/schedule-a/v1/record.schema.json",
  "title": "FEC processed Schedule A relation record",
  "type": "object",
  "additionalProperties": false,
  "required": [
    "cmte_id", "cmte_nm", "contbr_id", "contbr_nm", "contbr_nm_first",
    "contbr_m_nm", "contbr_nm_last", "contbr_prefix", "contbr_suffix",
    "contbr_st1", "contbr_st2", "contbr_city", "contbr_st", "contbr_zip",
    "entity_tp", "entity_tp_desc", "contbr_employer", "contbr_occupation",
    "election_tp", "fec_election_tp_desc", "fec_election_yr",
    "election_tp_desc", "contb_aggregate_ytd", "contb_receipt_dt",
    "contb_receipt_amt", "receipt_tp", "receipt_tp_desc", "receipt_desc",
    "memo_cd", "memo_cd_desc", "memo_text", "cand_id", "cand_nm",
    "cand_nm_first", "cand_m_nm", "cand_nm_last", "cand_prefix",
    "cand_suffix", "cand_office", "cand_office_desc", "cand_office_st",
    "cand_office_st_desc", "cand_office_district", "conduit_cmte_id",
    "conduit_cmte_nm", "conduit_cmte_st1", "conduit_cmte_st2",
    "conduit_cmte_city", "conduit_cmte_st", "conduit_cmte_zip",
    "donor_cmte_nm", "national_cmte_nonfed_acct", "increased_limit",
    "action_cd", "action_cd_desc", "tran_id", "back_ref_tran_id",
    "back_ref_sched_nm", "schedule_type", "schedule_type_desc", "line_num",
    "image_num", "file_num", "link_id", "orig_sub_id", "sub_id",
    "filing_form", "rpt_tp", "rpt_yr", "two_year_transaction_period",
    "pdf_url", "contributor_name_text", "contributor_employer_text",
    "contributor_occupation_text", "is_individual", "clean_contbr_id",
    "pg_date", "line_number_label", "cmte_tp", "org_tp", "cmte_dsgn"
  ],
  "$defs": {
    "nullable_text": {"type": ["string", "null"]},
    "money": {"type": ["string", "null"], "pattern": "^-?(0|[1-9][0-9]*)(\\.[0-9]+)?$"},
    "integer": {"type": ["string", "null"], "pattern": "^-?[0-9]+$"},
    "timestamp_without_timezone": {"type": ["string", "null"], "pattern": "^[0-9]{4}-[0-9]{2}-[0-9]{2} [0-9]{2}:[0-9]{2}:[0-9]{2}(\\.[0-9]+)?$"}
  },
  "properties": {
    "cmte_id": {"$ref": "#/$defs/nullable_text"},
    "cmte_nm": {"$ref": "#/$defs/nullable_text"},
    "contbr_id": {"$ref": "#/$defs/nullable_text"},
    "contbr_nm": {"$ref": "#/$defs/nullable_text"},
    "contbr_nm_first": {"$ref": "#/$defs/nullable_text"},
    "contbr_m_nm": {"$ref": "#/$defs/nullable_text"},
    "contbr_nm_last": {"$ref": "#/$defs/nullable_text"},
    "contbr_prefix": {"$ref": "#/$defs/nullable_text"},
    "contbr_suffix": {"$ref": "#/$defs/nullable_text"},
    "contbr_st1": {"$ref": "#/$defs/nullable_text"},
    "contbr_st2": {"$ref": "#/$defs/nullable_text"},
    "contbr_city": {"$ref": "#/$defs/nullable_text"},
    "contbr_st": {"$ref": "#/$defs/nullable_text"},
    "contbr_zip": {"$ref": "#/$defs/nullable_text"},
    "entity_tp": {"$ref": "#/$defs/nullable_text"},
    "entity_tp_desc": {"$ref": "#/$defs/nullable_text"},
    "contbr_employer": {"$ref": "#/$defs/nullable_text"},
    "contbr_occupation": {"$ref": "#/$defs/nullable_text"},
    "election_tp": {"$ref": "#/$defs/nullable_text"},
    "fec_election_tp_desc": {"$ref": "#/$defs/nullable_text"},
    "fec_election_yr": {"$ref": "#/$defs/nullable_text"},
    "election_tp_desc": {"$ref": "#/$defs/nullable_text"},
    "contb_aggregate_ytd": {"$ref": "#/$defs/money"},
    "contb_receipt_dt": {"$ref": "#/$defs/timestamp_without_timezone"},
    "contb_receipt_amt": {"$ref": "#/$defs/money"},
    "receipt_tp": {"$ref": "#/$defs/nullable_text"},
    "receipt_tp_desc": {"$ref": "#/$defs/nullable_text"},
    "receipt_desc": {"$ref": "#/$defs/nullable_text"},
    "memo_cd": {"$ref": "#/$defs/nullable_text"},
    "memo_cd_desc": {"$ref": "#/$defs/nullable_text"},
    "memo_text": {"$ref": "#/$defs/nullable_text"},
    "cand_id": {"$ref": "#/$defs/nullable_text"},
    "cand_nm": {"$ref": "#/$defs/nullable_text"},
    "cand_nm_first": {"$ref": "#/$defs/nullable_text"},
    "cand_m_nm": {"$ref": "#/$defs/nullable_text"},
    "cand_nm_last": {"$ref": "#/$defs/nullable_text"},
    "cand_prefix": {"$ref": "#/$defs/nullable_text"},
    "cand_suffix": {"$ref": "#/$defs/nullable_text"},
    "cand_office": {"$ref": "#/$defs/nullable_text"},
    "cand_office_desc": {"$ref": "#/$defs/nullable_text"},
    "cand_office_st": {"$ref": "#/$defs/nullable_text"},
    "cand_office_st_desc": {"$ref": "#/$defs/nullable_text"},
    "cand_office_district": {"$ref": "#/$defs/nullable_text"},
    "conduit_cmte_id": {"$ref": "#/$defs/nullable_text"},
    "conduit_cmte_nm": {"$ref": "#/$defs/nullable_text"},
    "conduit_cmte_st1": {"$ref": "#/$defs/nullable_text"},
    "conduit_cmte_st2": {"$ref": "#/$defs/nullable_text"},
    "conduit_cmte_city": {"$ref": "#/$defs/nullable_text"},
    "conduit_cmte_st": {"$ref": "#/$defs/nullable_text"},
    "conduit_cmte_zip": {"$ref": "#/$defs/nullable_text"},
    "donor_cmte_nm": {"$ref": "#/$defs/nullable_text"},
    "national_cmte_nonfed_acct": {"$ref": "#/$defs/nullable_text"},
    "increased_limit": {"$ref": "#/$defs/nullable_text"},
    "action_cd": {"$ref": "#/$defs/nullable_text"},
    "action_cd_desc": {"$ref": "#/$defs/nullable_text"},
    "tran_id": {"$ref": "#/$defs/nullable_text"},
    "back_ref_tran_id": {"$ref": "#/$defs/nullable_text"},
    "back_ref_sched_nm": {"$ref": "#/$defs/nullable_text"},
    "schedule_type": {"$ref": "#/$defs/nullable_text"},
    "schedule_type_desc": {"$ref": "#/$defs/nullable_text"},
    "line_num": {"$ref": "#/$defs/nullable_text"},
    "image_num": {"$ref": "#/$defs/nullable_text"},
    "file_num": {"$ref": "#/$defs/integer"},
    "link_id": {"$ref": "#/$defs/integer"},
    "orig_sub_id": {"$ref": "#/$defs/integer"},
    "sub_id": {"type": "string", "pattern": "^[0-9]+$"},
    "filing_form": {"type": "string", "minLength": 1},
    "rpt_tp": {"$ref": "#/$defs/nullable_text"},
    "rpt_yr": {"$ref": "#/$defs/integer"},
    "two_year_transaction_period": {"$ref": "#/$defs/integer"},
    "pdf_url": {"type": ["string", "null"], "format": "uri"},
    "contributor_name_text": {"$ref": "#/$defs/nullable_text"},
    "contributor_employer_text": {"$ref": "#/$defs/nullable_text"},
    "contributor_occupation_text": {"$ref": "#/$defs/nullable_text"},
    "is_individual": {"type": ["boolean", "null"]},
    "clean_contbr_id": {"$ref": "#/$defs/nullable_text"},
    "pg_date": {"$ref": "#/$defs/timestamp_without_timezone"},
    "line_number_label": {"$ref": "#/$defs/nullable_text"},
    "cmte_tp": {"$ref": "#/$defs/nullable_text"},
    "org_tp": {"$ref": "#/$defs/nullable_text"},
    "cmte_dsgn": {"$ref": "#/$defs/nullable_text"}
  }
}
