{
  "action_cd": "C",
  "action_cd_desc": "CHANGE",
  "back_ref_sched_nm": null,
  "back_ref_tran_id": null,
  "cand_id": "H6GA13120",
  "cand_m_nm": null,
  "cand_nm": "FAUNTLEROY, JEFF",
  "cand_nm_first": "JEFF",
  "cand_nm_last": "FAUNTLEROY",
  "cand_office": "H",
  "cand_office_desc": "HOUSE",
  "cand_office_district": "13",
  "cand_office_st": "GA",
  "cand_office_st_desc": "GEORGIA",
  "cand_prefix": null,
  "cand_suffix": null,
  "clean_contbr_id": null,
  "cmte_dsgn": "P",
  "cmte_id": "C00920678",
  "cmte_nm": null,
  "cmte_tp": "H",
  "conduit_cmte_city": null,
  "conduit_cmte_id": null,
  "conduit_cmte_nm": null,
  "conduit_cmte_st": null,
  "conduit_cmte_st1": null,
  "conduit_cmte_st2": null,
  "conduit_cmte_zip": null,
  "contb_aggregate_ytd": "20000.00",
  "contb_receipt_amt": "20000.00",
  "contb_receipt_dt": "2025-10-01 00:00:00",
  "contbr_city": "SNELLVILLE",
  "contbr_employer": "J. FAUNTLEROY & ASSOCIATES LLC",
  "contbr_id": null,
  "contbr_m_nm": null,
  "contbr_nm": "FAUNTLEROY, JEFF",
  "contbr_nm_first": "JEFF",
  "contbr_nm_last": "FAUNTLEROY",
  "contbr_occupation": "CEO",
  "contbr_prefix": null,
  "contbr_st": "GA",
  "contbr_st1": "4450 GIN PLANTATION",
  "contbr_st2": null,
  "contbr_suffix": null,
  "contbr_zip": "30039",
  "contributor_employer_text": "'associates':3 'fauntleroy':2 'j':1 'llc':4",
  "contributor_name_text": "'fauntleroy':1 'jeff':2",
  "contributor_occupation_text": "'ceo':1",
  "donor_cmte_nm": null,
  "election_tp": "P2026",
  "election_tp_desc": null,
  "entity_tp": "CAN",
  "entity_tp_desc": "CANDIDATE",
  "fec_election_tp_desc": "PRIMARY",
  "fec_election_yr": "2026",
  "file_num": "1943888",
  "filing_form": "F3",
  "image_num": "202601319825753624",
  "increased_limit": null,
  "is_individual": false,
  "line_num": "13A",
  "line_number_label": "Loans Received from the Candidate",
  "link_id": "4020120261304449133",
  "memo_cd": null,
  "memo_cd_desc": null,
  "memo_text": null,
  "national_cmte_nonfed_acct": null,
  "org_tp": "",
  "orig_sub_id": null,
  "pdf_url": "https://docquery.fec.gov/cgi-bin/fecimg/?202601319825753624",
  "pg_date": "2026-03-03 03:06:03",
  "receipt_desc": null,
  "receipt_tp": "16C",
  "receipt_tp_desc": "LOANS RECEIVED FROM THE CANDIDATE",
  "rpt_tp": "YE",
  "rpt_yr": "2025",
  "schedule_type": "SA",
  "schedule_type_desc": "ITEMIZED RECEIPTS",
  "sub_id": "4030220261360499597",
  "tran_id": "SA13A.4105",
  "two_year_transaction_period": "2026"
}

