{
  "action_cd": "N",
  "action_cd_desc": "NO CHANGE",
  "back_ref_sched_nm": null,
  "back_ref_tran_id": null,
  "cand_id": null,
  "cand_m_nm": null,
  "cand_nm": null,
  "cand_nm_first": null,
  "cand_nm_last": null,
  "cand_office": null,
  "cand_office_desc": null,
  "cand_office_district": null,
  "cand_office_st": null,
  "cand_office_st_desc": null,
  "cand_prefix": null,
  "cand_suffix": null,
  "clean_contbr_id": "C00797670",
  "cmte_dsgn": "P",
  "cmte_id": "C00573949",
  "cmte_nm": null,
  "cmte_tp": "H",
  "conduit_cmte_city": null,
  "conduit_cmte_id": null,
  "conduit_cmte_nm": null,
  "conduit_cmte_st": null,
  "conduit_cmte_st1": null,
  "conduit_cmte_st2": null,
  "conduit_cmte_zip": null,
  "contb_aggregate_ytd": "107060.74",
  "contb_receipt_amt": "2500.0",
  "contb_receipt_dt": "2024-05-16 00:00:00",
  "contbr_city": "WASHINGTON",
  "contbr_employer": null,
  "contbr_id": "C00797670",
  "contbr_m_nm": null,
  "contbr_nm": "AMERICAN ISRAEL PUBLIC AFFAIRS COMMITTEE POLITICAL ACTION COMMITTEE",
  "contbr_nm_first": null,
  "contbr_nm_last": null,
  "contbr_occupation": "CONDUIT TOTAL LISTED IN AGG. FIELD",
  "contbr_prefix": null,
  "contbr_st": "DC",
  "contbr_st1": "251 H ST NW",
  "contbr_st2": null,
  "contbr_suffix": null,
  "contbr_zip": "200012604",
  "contributor_employer_text": null,
  "contributor_name_text": null,
  "contributor_occupation_text": null,
  "donor_cmte_nm": "AMERICAN ISRAEL PUBLIC AFFAIRS COMMITTEE POLITICAL ACTION COMMITTEE",
  "election_tp": "P2024",
  "election_tp_desc": null,
  "entity_tp": "PAC",
  "entity_tp_desc": "POLITICAL ACTION COMMITTEE",
  "fec_election_tp_desc": "PRIMARY",
  "fec_election_yr": "2024",
  "file_num": "1826199",
  "filing_form": "F3",
  "image_num": "202410159685547424",
  "increased_limit": null,
  "is_individual": false,
  "line_num": "11AI",
  "line_number_label": "Contributions From Individuals/Persons Other Than Political Committees",
  "link_id": "4101520242069565313",
  "memo_cd": "X",
  "memo_cd_desc": null,
  "memo_text": "NOTE: ABOVE CONTRIBUTION EARMARKED THROUGH THIS ORGANIZATION.",
  "national_cmte_nonfed_acct": null,
  "org_tp": null,
  "orig_sub_id": null,
  "pdf_url": "https://docquery.fec.gov/cgi-bin/fecimg/?202410159685547424",
  "pg_date": "2024-11-14 03:06:05",
  "receipt_desc": null,
  "receipt_tp": null,
  "receipt_tp_desc": null,
  "rpt_tp": "Q2",
  "rpt_yr": "2024",
  "schedule_type": "SA",
  "schedule_type_desc": "ITEMIZED RECEIPTS",
  "sub_id": "4111320241068313185",
  "tran_id": "6031398E",
  "two_year_transaction_period": "2024"
}
