{
  "action_cd": "A",
  "action_cd_desc": "ADD",
  "back_ref_sched_nm": null,
  "back_ref_tran_id": null,
  "cand_id": null,
  "cand_m_nm": null,
  "cand_nm": null,
  "cand_nm_first": null,
  "cand_nm_last": null,
  "cand_office": null,
  "cand_office_desc": null,
  "cand_office_district": "00",
  "cand_office_st": null,
  "cand_office_st_desc": null,
  "cand_prefix": null,
  "cand_suffix": null,
  "clean_contbr_id": "C00401224",
  "cmte_dsgn": "U",
  "cmte_id": "C00392928",
  "cmte_nm": null,
  "cmte_tp": "Y",
  "conduit_cmte_city": "SOMERVILLE",
  "conduit_cmte_id": null,
  "conduit_cmte_nm": "ACTBLUE",
  "conduit_cmte_st": "MA",
  "conduit_cmte_st1": "PO BOX 441146",
  "conduit_cmte_st2": null,
  "conduit_cmte_zip": "02144",
  "contb_aggregate_ytd": "1250.00",
  "contb_receipt_amt": "50.00",
  "contb_receipt_dt": "2026-05-16 00:00:00",
  "contbr_city": "SAN FRANCISCO",
  "contbr_employer": "SAN FRANCISCO DISTRICT ATTORNEY'S OFFI",
  "contbr_id": "C00401224",
  "contbr_m_nm": null,
  "contbr_nm": "TUNG, NANCY",
  "contbr_nm_first": "NANCY",
  "contbr_nm_last": "TUNG",
  "contbr_occupation": "LAWYER",
  "contbr_prefix": null,
  "contbr_st": "CA",
  "contbr_st1": "1027 FELTON STREET",
  "contbr_st2": null,
  "contbr_suffix": null,
  "contbr_zip": "94134",
  "contributor_employer_text": "'attorney':4 'district':3 'francisco':2 'offi':6 's':5 'san':1",
  "contributor_name_text": "'c00401224':3 'nancy':2 'tung':1",
  "contributor_occupation_text": "'lawyer':1",
  "donor_cmte_nm": null,
  "election_tp": "P",
  "election_tp_desc": null,
  "entity_tp": "IND",
  "entity_tp_desc": "INDIVIDUAL",
  "fec_election_tp_desc": "PRIMARY",
  "fec_election_yr": null,
  "file_num": "1997074",
  "filing_form": "F3X",
  "image_num": "202607159885305179",
  "increased_limit": null,
  "is_individual": true,
  "line_num": "11AI",
  "line_number_label": "Contributions From Individuals/Persons Other Than Political Committees",
  "link_id": "4071620261534513013",
  "memo_cd": null,
  "memo_cd_desc": null,
  "memo_text": null,
  "national_cmte_nonfed_acct": null,
  "org_tp": null,
  "orig_sub_id": null,
  "pdf_url": "https://docquery.fec.gov/cgi-bin/fecimg/?202607159885305179",
  "pg_date": "2026-07-17 03:08:24",
  "receipt_desc": null,
  "receipt_tp": "15E",
  "receipt_tp_desc": "EARMARKED CONTRIBUTION",
  "rpt_tp": "Q2",
  "rpt_yr": "2026",
  "schedule_type": "SA",
  "schedule_type_desc": "ITEMIZED RECEIPTS",
  "sub_id": "4071620261534530959",
  "tran_id": "DA4957",
  "two_year_transaction_period": "2026"
}

