{
  "action_cd": "F",
  "action_cd_desc": null,
  "back_ref_sched_nm": null,
  "back_ref_tran_id": null,
  "cand_id": null,
  "cand_m_nm": null,
  "cand_nm": null,
  "cand_nm_first": null,
  "cand_nm_last": null,
  "cand_office": null,
  "cand_office_desc": null,
  "cand_office_district": null,
  "cand_office_st": null,
  "cand_office_st_desc": null,
  "cand_prefix": null,
  "cand_suffix": null,
  "clean_contbr_id": null,
  "cmte_dsgn": "U",
  "cmte_id": "C00694323",
  "cmte_nm": null,
  "cmte_tp": "V",
  "conduit_cmte_city": null,
  "conduit_cmte_id": null,
  "conduit_cmte_nm": null,
  "conduit_cmte_st": null,
  "conduit_cmte_st1": null,
  "conduit_cmte_st2": null,
  "conduit_cmte_zip": null,
  "contb_aggregate_ytd": "308.12",
  "contb_receipt_amt": "1.04",
  "contb_receipt_dt": "2025-01-15 00:00:00",
  "contbr_city": "WEST COLUMBIA",
  "contbr_employer": "RETIRED",
  "contbr_id": null,
  "contbr_m_nm": null,
  "contbr_nm": "WEEMS VI, MASON LOCKE",
  "contbr_nm_first": "MASON LOCKE",
  "contbr_nm_last": "WEEMS VI",
  "contbr_occupation": "RETIRED",
  "contbr_prefix": null,
  "contbr_st": "TX",
  "contbr_st1": "PO BOX 368",
  "contbr_st2": null,
  "contbr_suffix": null,
  "contbr_zip": "774860368",
  "contributor_employer_text": "'retired':1",
  "contributor_name_text": "'locke':4 'mason':3 'vi':2 'weems':1",
  "contributor_occupation_text": "'retired':1",
  "donor_cmte_nm": null,
  "election_tp": "P",
  "election_tp_desc": null,
  "entity_tp": "IND",
  "entity_tp_desc": "INDIVIDUAL",
  "fec_election_tp_desc": "PRIMARY",
  "fec_election_yr": null,
  "file_num": "1945557",
  "filing_form": "F3X",
  "image_num": "202602099826245839",
  "increased_limit": null,
  "is_individual": true,
  "line_num": "11AI",
  "line_number_label": "Contributions From Individuals/Persons Other Than Political Committees",
  "link_id": "4020920261304835045",
  "memo_cd": null,
  "memo_cd_desc": null,
  "memo_text": null,
  "national_cmte_nonfed_acct": null,
  "org_tp": null,
  "orig_sub_id": null,
  "pdf_url": "https://docquery.fec.gov/cgi-bin/fecimg/?202602099826245839",
  "pg_date": "2026-03-05 03:06:19",
  "receipt_desc": "CONTRIBUTION",
  "receipt_tp": "15",
  "receipt_tp_desc": "CONTRIBUTION",
  "rpt_tp": "MY",
  "rpt_yr": "2025",
  "schedule_type": "SA",
  "schedule_type_desc": "ITEMIZED RECEIPTS",
  "sub_id": "4030420261387104740",
  "tran_id": "A61D864239F6F4A42BA2",
  "two_year_transaction_period": "2026"
}

