{
  "action_cd": "A",
  "action_cd_desc": "ADD",
  "back_ref_sched_nm": null,
  "back_ref_tran_id": null,
  "cand_id": null,
  "cand_m_nm": null,
  "cand_nm": null,
  "cand_nm_first": null,
  "cand_nm_last": null,
  "cand_office": null,
  "cand_office_desc": null,
  "cand_office_district": null,
  "cand_office_st": null,
  "cand_office_st_desc": null,
  "cand_prefix": null,
  "cand_suffix": null,
  "clean_contbr_id": null,
  "cmte_dsgn": "B",
  "cmte_id": "C00406892",
  "cmte_nm": null,
  "cmte_tp": "Q",
  "conduit_cmte_city": null,
  "conduit_cmte_id": null,
  "conduit_cmte_nm": null,
  "conduit_cmte_st": null,
  "conduit_cmte_st1": null,
  "conduit_cmte_st2": null,
  "conduit_cmte_zip": null,
  "contb_aggregate_ytd": "230.76",
  "contb_receipt_amt": "230.76",
  "contb_receipt_dt": null,
  "contbr_city": "SANTA CLARA",
  "contbr_employer": "APPLIED MATERIALS INC.",
  "contbr_id": null,
  "contbr_m_nm": null,
  "contbr_nm": "DEANE, TIMOTHY",
  "contbr_nm_first": "TIMOTHY",
  "contbr_nm_last": "DEANE",
  "contbr_occupation": "VP FIELD OPS/ STRATEGY/ PLANNING",
  "contbr_prefix": null,
  "contbr_st": "CA",
  "contbr_st1": "3050 BOWERS AVE",
  "contbr_st2": null,
  "contbr_suffix": null,
  "contbr_zip": "95054",
  "contributor_employer_text": "'applied':1 'inc':3 'materials':2",
  "contributor_name_text": "'deane':1 'timothy':2",
  "contributor_occupation_text": "'field':2 'ops':3 'planning':5 'strategy':4 'vp':1",
  "donor_cmte_nm": null,
  "election_tp": "P",
  "election_tp_desc": null,
  "entity_tp": "IND",
  "entity_tp_desc": "INDIVIDUAL",
  "fec_election_tp_desc": "PRIMARY",
  "fec_election_yr": null,
  "file_num": "1875766",
  "filing_form": "F3X",
  "image_num": "202502129753403325",
  "increased_limit": null,
  "is_individual": true,
  "line_num": "11AI",
  "line_number_label": "Contributions From Individuals/Persons Other Than Political Committees",
  "link_id": "4021220251172299053",
  "memo_cd": null,
  "memo_cd_desc": null,
  "memo_text": null,
  "national_cmte_nonfed_acct": null,
  "org_tp": "C",
  "orig_sub_id": null,
  "pdf_url": "https://docquery.fec.gov/cgi-bin/fecimg/?202502129753403325",
  "pg_date": "2025-02-14 03:34:42",
  "receipt_desc": "PAYROLL DEDUCTION ($115.38 BI-WEEKLY)",
  "receipt_tp": "15",
  "receipt_tp_desc": "CONTRIBUTION",
  "rpt_tp": "M2",
  "rpt_yr": "2025",
  "schedule_type": "SA",
  "schedule_type_desc": "ITEMIZED RECEIPTS",
  "sub_id": "4021320251172530657",
  "tran_id": "IA2643",
  "two_year_transaction_period": "2026"
}

